{
 "contract_version": "0.1",
 "classes": [
  "sit_down",
  "stand_up",
  "pick_up_object",
  "put_down_object",
  "open",
  "close",
  "put_on_wearable",
  "take_off_wearable"
 ],
 "run": {
  "run_id": "stageA-20261003T081316Z",
  "stage": "A",
  "created_utc": "2026-10-03T08:13:16Z",
  "manifest_sha256": "66181cb255b14c8d3e0adcb188694f0bfb10461435975905f0a9c5e3bd74f321",
  "out_of_fold": true,
  "weights": [
   {
    "name": "yolo11n.pt",
    "source": "https://github.com/ultralytics/assets/releases/download/v8.3.0/yolo11n.pt",
    "sha256": "0ebbc80d4a7680d14987a577cd21342b65ecfd94632bd9a8da63ae6417644ee1",
    "role": "person_detector",
    "license": "AGPL-3.0 (Ultralytics), COCO-trained"
   },
   {
    "name": "yolo11n-pose.pt",
    "source": "https://github.com/ultralytics/assets/releases/download/v8.3.0/yolo11n-pose.pt",
    "sha256": "869e83fcdffdc7371fa4e34cd8e51c838cc729571d1635e5141e3075e9319dc0",
    "role": "pose",
    "license": "AGPL-3.0 (Ultralytics), COCO-keypoints-trained"
   },
   {
    "name": "r2plus1d_18-91a641e6.pth",
    "source": "https://download.pytorch.org/models/r2plus1d_18-91a641e6.pth",
    "sha256": "91a641e6c2ab531d1aca5f4321b4d802ec5c3babc15df855cdb6e39c6a1107c8",
    "role": "video_backbone",
    "license": "BSD-3-Clause (torchvision code/weights), Kinetics-400-trained"
   },
   {
    "name": "CLIP ViT-B-32 (openai)",
    "source": "https://openaipublic.azureedge.net/clip/models/40d365715913c9da98579312b702a82c18be219cc2a73407c4526f58eba950af/ViT-B-32.pt",
    "sha256": "40d365715913c9da98579312b702a82c18be219cc2a73407c4526f58eba950af",
    "role": "other",
    "license": "MIT (OpenAI CLIP), WebImageText-400M-trained; frame/state image encoder"
   },
   {
    "name": "oof_logreg_heads_x5",
    "source": "trained in-repo by scripts/train_oof.py (nested OOF)",
    "sha256": "c6d3b5ed0c2fb53583fabb779613ecbf502036cde4ef9b5fb92e8ae537c45b76",
    "role": "classifier_head",
    "license": "project-internal"
   }
  ],
  "abstention": {
   "method": "max-prob threshold on temperature-scaled probs; per outer fold, chosen on inner leave-one-fold-out OOF for selective risk <= 0.2",
   "per_fold_threshold": [
    0.771471,
    0.87363,
    0.624543,
    0.641283,
    0.840934
   ],
   "per_fold_temperature": [
    0.97992,
    0.934489,
    0.900618,
    0.857439,
    0.882281
   ]
  },
  "notes": "frozen features on GT track crops: CLIP ViT-B/32 start/end state embeddings + prompt sims, YOLO11n-pose keypoint stats, R(2+1)D-18 clip embeddings; L2 logistic regression; feature set ['state+pose', 'state+pose+motion'], C [0.001, 0.003, 0.01, 0.03] and time-reversal augmentation weight [0.0, 0.5] (reversed segment labelled as pair partner) chosen per outer fold by inner-OOF NLL; per-fold: [('state+pose', 0.5, 0.01), ('state+pose', 0.5, 0.01), ('state+pose', 0.5, 0.01), ('state+pose', 0.0, 0.01), ('state+pose', 0.5, 0.01)]"
 },
 "predictions": [
  {
   "segment_id": "151f1e24-0747-4970-9323-64d9ca895fb16846649325518994652__3f9018b5",
   "fold": 0,
   "pred_class": "pick_up_object",
   "probs": [
    0.027446,
    0.031758,
    0.456345,
    0.08031,
    0.072983,
    0.023942,
    0.128147,
    0.179069
   ],
   "confidence": 0.456345,
   "abstain": true,
   "second_class": "take_off_wearable",
   "abstain_reason": "low_confidence"
  },
  {
   "segment_id": "151f1e24-0747-4970-9323-64d9ca895fb16846649325518994652__3f9018b6",
   "fold": 0,
   "pred_class": "pick_up_object",
   "probs": [
    0.015107,
    0.034746,
    0.794592,
    0.044862,
    0.020533,
    0.032631,
    0.041713,
    0.015816
   ],
   "confidence": 0.794592,
   "abstain": false,
   "second_class": "put_down_object"
  },
  {
   "segment_id": "151f1e24-0747-4970-9323-64d9ca895fb16846649325518994652__3f9018b7",
   "fold": 0,
   "pred_class": "take_off_wearable",
   "probs": [
    0.078493,
    0.023574,
    0.268028,
    0.17497,
    0.013918,
    0.057839,
    0.091401,
    0.291777
   ],
   "confidence": 0.291777,
   "abstain": true,
   "second_class": "pick_up_object",
   "abstain_reason": "low_confidence"
  },
  {
   "segment_id": "151f1e24-0747-4970-9323-64d9ca895fb16846649325518994652__3f9018b8",
   "fold": 0,
   "pred_class": "pick_up_object",
   "probs": [
    0.072838,
    0.024795,
    0.665405,
    0.023837,
    0.034953,
    0.015169,
    0.106586,
    0.056417
   ],
   "confidence": 0.665405,
   "abstain": true,
   "second_class": "put_on_wearable",
   "abstain_reason": "low_confidence"
  },
  {
   "segment_id": "151f1e24-0747-4970-9323-64d9ca895fb16846649325518994652__3f9018b9",
   "fold": 0,
   "pred_class": "put_down_object",
   "probs": [
    0.102845,
    0.031295,
    0.091581,
    0.441523,
    0.021141,
    0.046691,
    0.13227,
    0.132654
   ],
   "confidence": 0.441523,
   "abstain": true,
   "second_class": "take_off_wearable",
   "abstain_reason": "low_confidence"
  },
  {
   "segment_id": "151f1e24-0747-4970-9323-64d9ca895fb16846649325518994652__3f9018ba",
   "fold": 0,
   "pred_class": "sit_down",
   "probs": [
    0.444569,
    0.019642,
    0.225677,
    0.160081,
    0.021346,
    0.020374,
    0.033949,
    0.074362
   ],
   "confidence": 0.444569,
   "abstain": true,
   "second_class": "pick_up_object",
   "abstain_reason": "low_confidence"
  },
  {
   "segment_id": "151f1e24-0747-4970-9323-64d9ca895fb16846649325518994652__3f9018bb",
   "fold": 0,
   "pred_class": "put_down_object",
   "probs": [
    0.024817,
    0.152457,
    0.258231,
    0.393774,
    0.058396,
    0.022948,
    0.069401,
    0.019976
   ],
   "confidence": 0.393774,
   "abstain": true,
   "second_class": "pick_up_object",
   "abstain_reason": "confusable_pair_margin"
  },
  {
   "segment_id": "151f1e24-0747-4970-9323-64d9ca895fb16846649325518994652__3f9018bc",
   "fold": 0,
   "pred_class": "pick_up_object",
   "probs": [
    0.005977,
    0.053257,
    0.814571,
    0.008871,
    0.014996,
    0.051654,
    0.0224,
    0.028274
   ],
   "confidence": 0.814571,
   "abstain": false,
   "second_class": "stand_up"
  },
  {
   "segment_id": "151f1e24-0747-4970-9323-64d9ca895fb16846649325518994652__3f9018bd",
   "fold": 0,
   "pred_class": "open",
   "probs": [
    0.053324,
    0.078831,
    0.244147,
    0.109541,
    0.247036,
    0.082427,
    0.084696,
    0.099998
   ],
   "confidence": 0.247036,
   "abstain": true,
   "second_class": "pick_up_object",
   "abstain_reason": "low_confidence"
  },
  {
   "segment_id": "22440566-2623-4a06-a3fe-d79c9cb2376c4363484356028427887__3f90f3ce",
   "fold": 0,
   "pred_class": "pick_up_object",
   "probs": [
    0.013705,
    0.141347,
    0.391243,
    0.03932,
    0.021917,
    0.369234,
    0.013119,
    0.010115
   ],
   "confidence": 0.391243,
   "abstain": true,
   "second_class": "close",
   "abstain_reason": "low_confidence"
  },
  {
   "segment_id": "36970B11-044E-450E-A923-263DB852A10C__3f92435e",
   "fold": 0,
   "pred_class": "pick_up_object",
   "probs": [
    0.03994,
    0.059627,
    0.61649,
    0.129474,
    0.034297,
    0.071076,
    0.021908,
    0.027188
   ],
   "confidence": 0.61649,
   "abstain": true,
   "second_class": "put_down_object",
   "abstain_reason": "confusable_pair_margin"
  },
  {
   "segment_id": "36970B11-044E-450E-A923-263DB852A10C__3f92435f",
   "fold": 0,
   "pred_class": "put_down_object",
   "probs": [
    0.019593,
    0.130715,
    0.16906,
    0.566719,
    0.072534,
    0.016027,
    0.016769,
    0.008583
   ],
   "confidence": 0.566719,
   "abstain": true,
   "second_class": "pick_up_object",
   "abstain_reason": "confusable_pair_margin"
  },
  {
   "segment_id": "36970B11-044E-450E-A923-263DB852A10C__3f924362",
   "fold": 0,
   "pred_class": "sit_down",
   "probs": [
    0.397072,
    0.014543,
    0.245996,
    0.172229,
    0.041628,
    0.056057,
    0.025801,
    0.046674
   ],
   "confidence": 0.397072,
   "abstain": true,
   "second_class": "pick_up_object",
   "abstain_reason": "low_confidence"
  },
  {
   "segment_id": "36970B11-044E-450E-A923-263DB852A10C__3f924363",
   "fold": 0,
   "pred_class": "put_down_object",
   "probs": [
    0.082769,
    0.128826,
    0.184077,
    0.305039,
    0.123954,
    0.064065,
    0.044451,
    0.066819
   ],
   "confidence": 0.305039,
   "abstain": true,
   "second_class": "pick_up_object",
   "abstain_reason": "confusable_pair_margin"
  },
  {
   "segment_id": "3f70e87b-596f-4fc5-ac6c-4357a2f168d81786827759781102555__3f92d357",
   "fold": 0,
   "pred_class": "open",
   "probs": [
    0.040395,
    0.024536,
    0.024252,
    0.082689,
    0.467534,
    0.231082,
    0.056187,
    0.073325
   ],
   "confidence": 0.467534,
   "abstain": true,
   "second_class": "close",
   "abstain_reason": "confusable_pair_margin"
  },
  {
   "segment_id": "3f70e87b-596f-4fc5-ac6c-4357a2f168d81786827759781102555__3f92d359",
   "fold": 0,
   "pred_class": "close",
   "probs": [
    0.024911,
    0.038107,
    0.12786,
    0.019114,
    0.26683,
    0.423399,
    0.063693,
    0.036086
   ],
   "confidence": 0.423399,
   "abstain": true,
   "second_class": "open",
   "abstain_reason": "confusable_pair_margin"
  },
  {
   "segment_id": "3f70e87b-596f-4fc5-ac6c-4357a2f168d81786827759781102555__3f92d35a",
   "fold": 0,
   "pred_class": "open",
   "probs": [
    0.03033,
    0.074689,
    0.123562,
    0.185373,
    0.346234,
    0.143869,
    0.057007,
    0.038936
   ],
   "confidence": 0.346234,
   "abstain": true,
   "second_class": "put_down_object",
   "abstain_reason": "low_confidence"
  },
  {
   "segment_id": "3f70e87b-596f-4fc5-ac6c-4357a2f168d81786827759781102555__3f92d35d",
   "fold": 0,
   "pred_class": "open",
   "probs": [
    0.041203,
    0.057388,
    0.082316,
    0.091913,
    0.424748,
    0.233118,
    0.03155,
    0.037764
   ],
   "confidence": 0.424748,
   "abstain": true,
   "second_class": "close",
   "abstain_reason": "confusable_pair_margin"
  },
  {
   "segment_id": "3f70e87b-596f-4fc5-ac6c-4357a2f168d81786827759781102555__3f92d35e",
   "fold": 0,
   "pred_class": "close",